url,title
https://baomoi.com/tieu-su-dong-chi-ho-van-mung-tan-pho-bi-thu-tinh-uy-chu-tich-ubnd-tinh-an-giang-c50155038.epi,"Tiểu sử đồng chí Hồ Văn Mừng, tân Phó Bí thư Tỉnh ủy, Chủ tịch UBND tỉnh An Giang"
https://baomoi.com/ban-bi-thu-chi-dinh-chuan-y-nhan-su-3-tinh-c50148753.epi,"Ban Bí thư chỉ định, chuẩn y nhân sự 3 tỉnh"
https://baomoi.com/tp-hcm-se-doi-thoai-voi-cac-dia-phuong-ve-chuyen-doi-cong-nghiep-c50158224.epi,Tp.HCM sẽ đối thoại với các địa phương về chuyển đổi công nghiệp
https://baomoi.com/han-quoc-vien-tro-2-trieu-usd-nhat-giup-vat-tu-de-viet-nam-khac-phuc-hau-qua-bao-lu-c50155508.epi,"Hàn Quốc viện trợ 2 triệu USD, Nhật giúp vật tư để Việt Nam khắc phục hậu quả bão lũ"
https://baomoi.com/le-phat-dong-quyen-gop-ung-ho-dong-bao-cac-tinh-thanh-pho-phia-bac-bi-thiet-hai-do-bao-lu-c50158182.epi,"Lễ phát động quyên góp ủng hộ đồng bào các tỉnh, thành phố phía Bắc bị thiệt hại do bão, lũ"
https://baomoi.com/bo-nhiem-nu-truong-khoa-ke-toan-giu-chuc-pho-vu-truong-c50158216.epi,Bổ nhiệm nữ Trưởng khoa Kế toán giữ chức Phó Vụ trưởng
https://baomoi.com/huyen-phu-giao-chung-tay-thuc-hien-thanh-cong-cac-muc-tieu-phat-trien-kinh-te-xa-hoi-c50158170.epi,Huyện Phú Giáo: Chung tay thực hiện thành công các mục tiêu phát triển kinh tế - xã hội
https://baomoi.com/cu-the-hoa-va-thuc-hien-dung-cac-quy-dinh-cua-luat-thuc-hien-dan-chu-o-co-so-c50158204.epi,Cụ thể hóa và thực hiện đúng các quy định của Luật Thực hiện dân chủ ở cơ sở
https://baomoi.com/doan-kiem-tra-cua-bo-chinh-tri-lam-viec-voi-ban-thuong-vu-tinh-uy-quang-tri-c50158103.epi,Đoàn kiểm tra của Bộ Chính trị làm việc với Ban Thường vụ Tỉnh ủy Quảng Trị
https://baomoi.com/cu-tri-danh-gia-cao-uy-ban-thuong-vu-quoc-hoi-giam-sat-den-cung-c50158104.epi,Cử tri đánh giá cao Ủy ban Thường vụ Quốc hội 'giám sát đến cùng'
https://baomoi.com/tinh-trang-bao-hanh-tre-em-van-tiep-tuc-dien-ra-tai-nhieu-dia-phuong-c50158073.epi,Tình trạng bạo hành trẻ em vẫn tiếp tục diễn ra tại nhiều địa phương
https://baomoi.com/khai-mac-hoi-nghi-mang-luoi-cong-vien-dia-chat-toan-cau-unesco-c50158075.epi,Khai mạc Hội nghị Mạng lưới Công viên Địa chất toàn cầu UNESCO
https://baomoi.com/tang-cuong-hop-tac-giua-hai-ban-to-chuc-trung-uong-viet-nam-lao-c50158134.epi,Tăng cường hợp tác giữa hai Ban Tổ chức Trung ương Việt Nam-Lào
https://baomoi.com/ban-bi-thu-chi-dinh-dai-ta-nguyen-hong-phong-tham-gia-ban-thuong-vu-tinh-uy-dong-nai-c50158050.epi,Ban Bí thư chỉ định Đại tá Nguyễn Hồng Phong tham gia Ban Thường vụ Tỉnh ủy Đồng Nai
https://baomoi.com/pho-chu-tich-ubnd-tphcm-tiep-doan-phong-thuong-mai-an-do-icc-c50157954.epi,Phó Chủ tịch UBND TPHCM tiếp đoàn Phòng Thương mại Ấn Độ (ICC)
https://baomoi.com/tap-trung-nguon-luc-ho-tro-nguoi-dan-vung-bao-lu-c50157972.epi,Tập trung nguồn lực hỗ trợ người dân vùng bão lũ
https://baomoi.com/hoi-luat-gia-tinh-hung-yen-tiep-tuc-xay-dung-hoi-ngay-cang-phat-trien-vung-manh-c50157990.epi,Hội Luật gia tỉnh Hưng Yên: Tiếp tục xây dựng Hội ngày càng phát triển vững mạnh
https://baomoi.com/lay-y-kien-nhan-dan-doi-voi-du-thao-bao-cao-chinh-tri-trinh-dai-hoi-dai-bieu-toan-quoc-mttq-viet-nam-lan-thu-x-nhiem-ky-2024-2029-c50157966.epi,"Lấy ý kiến nhân dân đối với dự thảo Báo cáo chính trị trình Đại hội đại biểu toàn quốc MTTQ Việt Nam lần thứ X, nhiệm kỳ 2024 - 2029"
https://baomoi.com/ong-rah-lan-chung-giu-chuc-chu-tich-tinh-gia-lai-c50157871.epi,Ông Rah Lan Chung giữ chức Chủ tịch tỉnh Gia Lai
https://baomoi.com/doan-dai-bieu-bo-quoc-phong-viet-nam-tham-du-doi-thoai-quoc-phong-seoul-c50157911.epi,Đoàn đại biểu Bộ Quốc phòng Việt Nam tham dự Đối thoại Quốc phòng Seoul
https://baomoi.com/chuyen-doi-cong-nghiep-dong-luc-moi-giup-tp-hcm-phat-trien-ben-vung-c50157829.epi,Chuyển đổi công nghiệp: Động lực mới giúp TP.HCM phát triển bền vững
https://baomoi.com/hoan-thanh-khoi-luong-lon-nhiem-vu-lap-phap-khong-co-tinh-trang-xin-rut-cac-du-an-c50157756.epi,"Hoàn thành khối lượng lớn nhiệm vụ lập pháp, không có tình trạng xin rút các dự án"
https://baomoi.com/16-quoc-gia-tham-du-doi-thoai-huu-nghi-tphcm-lan-thu-2-c50157731.epi,16 quốc gia tham dự Đối thoại Hữu nghị TPHCM lần thứ 2
https://baomoi.com/hoi-thao-ve-55-nam-thuc-hien-di-chuc-cua-chu-tich-ho-chi-minh-c50157850.epi,Hội thảo về 55 năm thực hiện Di chúc của Chủ tịch Hồ Chí Minh
https://baomoi.com/thanh-uy-ben-cat-trien-khai-quan-triet-ke-hoach-to-chuc-dai-hoi-dang-bo-cac-cap-c50157600.epi,Thành ủy Bến Cát: Triển khai quán triệt kế hoạch tổ chức đại hội đảng bộ các cấp
https://baomoi.com/ban-bi-thu-chi-nhan-su-dinh-tham-gia-ban-chap-hanh-ban-thuong-vu-tinh-uy-c50157562.epi,"Ban Bí thư chỉ nhân sự định tham gia Ban Chấp hành, Ban Thường vụ Tỉnh ủy"
https://baomoi.com/pho-thu-tuong-bo-truong-ngoai-giao-bui-thanh-son-lam-viec-tai-cao-bang-c50157516.epi,"Phó Thủ tướng, Bộ trưởng Ngoại giao Bùi Thanh Sơn làm việc tại Cao Bằng"
https://baomoi.com/phoi-hop-phong-ngua-giai-quyet-khieu-kien-dong-nguoi-phuc-tap-c50157935.epi,"Phối hợp phòng ngừa, giải quyết khiếu kiện đông người, phức tạp"
https://baomoi.com/ton-vinh-thuong-hieu-cong-vien-dia-chat-toan-cau-non-nuoc-cao-bang-c50157530.epi,Tôn vinh thương hiệu Công viên địa chất toàn cầu Non nước Cao Bằng
https://baomoi.com/lai-chau-tap-huan-ve-xay-dung-cac-van-kien-dai-hoi-dang-bo-cac-cap-nhiem-ky-2025-2030-c50157780.epi,"Lai Châu: Tập huấn về xây dựng các văn kiện Đại hội Đảng bộ các cấp, nhiệm kỳ 2025-2030"
https://baomoi.com/toa-dam-ket-noi-viet-nam-maldives-thuc-day-hon-nua-hop-tac-kinh-te-thuong-mai-dau-tu-c50157737.epi,"Tọa đàm kết nối Việt Nam-Maldives: Thúc đẩy hơn nữa hợp tác kinh tế, thương mại, đầu tư"
https://baomoi.com/viet-nam-lien-bang-nga-dau-moc-moi-cho-quan-he-lien-nghi-vien-c50157430.epi,Việt Nam-Liên bang Nga: Dấu mốc mới cho quan hệ liên nghị viện
https://baomoi.com/chuong-trinh-ung-ho-dong-bao-bi-thiet-hai-do-ubtu-mttq-viet-nam-phat-dong-the-hien-truyen-thong-tot-dep-c50157732.epi,Chương trình ủng hộ đồng bào bị thiệt hại do UBTƯ MTTQ Việt Nam phát động thể hiện truyền thống tốt đẹp
https://baomoi.com/bi-thu-thanh-uy-nha-trang-lam-chu-tich-ubnd-tinh-an-giang-c50157390.epi,Bí thư Thành ủy Nha Trang làm Chủ tịch UBND tỉnh An Giang
https://baomoi.com/50-thi-sinh-tranh-tai-tai-hoi-thi-tieng-lao-trong-bo-doi-bien-phong-c50157344.epi,50 thí sinh tranh tài tại hội thi tiếng Lào trong Bộ đội Biên phòng
https://baomoi.com/lanh-dao-ubnd-tinh-an-giang-tiep-tong-lanh-su-an-do-c50157367.epi,Lãnh đạo UBND tỉnh An Giang tiếp Tổng Lãnh sự Ấn Độ
https://baomoi.com/huong-thuy-bo-sung-quy-hoach-can-bo-lanh-dao-quan-ly-c50157621.epi,"Hương Thủy: Bổ sung quy hoạch cán bộ lãnh đạo, quản lý"
https://baomoi.com/tp-hue-tiep-nhan-1-1-ty-dong-cua-296-to-chuc-ca-nhan-ung-ho-khac-phuc-bao-so-3-c50157452.epi,"TP. Huế tiếp nhận 1,1 tỷ đồng của 296 tổ chức, cá nhân ủng hộ khắc phục bão số 3"
https://baomoi.com/tiep-tuc-xac-dinh-cai-cach-hanh-chinh-chuyen-doi-so-va-thuc-hien-de-an-06-la-nhiem-vu-trong-tam-xuyen-suot-c50157465.epi,"Tiếp tục xác định cải cách hành chính, chuyển đổi số và thực hiện Đề án 06 là nhiệm vụ trọng tâm, xuyên suốt"
https://baomoi.com/mong-muon-bao-nhan-dan-tiep-tuc-dong-hanh-voi-tinh-phu-yen-c50157533.epi,Mong muốn Báo Nhân Dân tiếp tục đồng hành với tỉnh Phú Yên
https://baomoi.com/thai-lan-neu-hang-loat-uu-tien-chinh-sach-cua-chinh-phu-c50157382.epi,Thái Lan nêu hàng loạt ưu tiên chính sách của Chính phủ
https://baomoi.com/tp-my-tho-bieu-duong-nguoi-cao-tuoi-tieu-bieu-tham-gia-xay-dung-he-thong-chinh-tri-o-co-so-c50157545.epi,TP. Mỹ Tho: Biểu dương người cao tuổi tiêu biểu tham gia xây dựng hệ thống chính trị ở cơ sở
https://baomoi.com/cho-y-kien-vao-du-thao-de-cuong-bao-cao-chinh-tri-dai-hoi-dai-bieu-dang-bo-tinh-lan-thu-xviii-c50157459.epi,Cho ý kiến vào dự thảo đề cương Báo cáo chính trị Đại hội đại biểu Đảng bộ tỉnh lần thứ XVIII
https://baomoi.com/ky-niem-70-nam-ngay-truyen-thong-dang-bo-huyen-kbang-c50157296.epi,Kỷ niệm 70 năm ngày Truyền thống Đảng bộ huyện Kbang
https://baomoi.com/khai-mac-phien-hop-thu-37-cua-uy-ban-thuong-vu-quoc-hoi-c50157469.epi,Khai mạc phiên họp thứ 37 của Ủy ban Thường vụ Quốc hội
https://baomoi.com/pho-thu-tuong-chinh-phu-bui-thanh-son-tham-va-lam-viec-tai-don-bien-phong-dam-thuy-c50157170.epi,Phó Thủ tướng Chính phủ Bùi Thanh Sơn thăm và làm việc tại Đồn Biên phòng Đàm Thủy
https://baomoi.com/nhung-luu-y-ve-xay-dung-van-kien-dai-hoi-c50157190.epi,Những lưu ý về xây dựng văn kiện đại hội
https://baomoi.com/dai-ta-nguyen-hong-phong-duoc-ban-bi-thu-chi-dinh-tham-gia-ban-chap-hanh-ban-thuong-vu-tinh-uy-dong-nai-c50157248.epi,"Đại tá Nguyễn Hồng Phong được Ban Bí thư chỉ định tham gia Ban Chấp hành, Ban Thường vụ Tỉnh ủy Đồng Nai"
https://baomoi.com/lanh-dao-tp-hcm-chuc-mung-gs-nguyen-thi-ngoc-phuong-nhan-giai-nobel-chau-a-c50157172.epi,Lãnh đạo TP.HCM chúc mừng GS Nguyễn Thị Ngọc Phượng nhận giải 'Nobel châu Á'
https://baomoi.com/tap-huan-cho-doan-dai-bieu-tham-gia-phien-hop-gia-dinh-quoc-hoi-tre-em-lan-thu-ii-nam-2024-c50157284.epi,Tập huấn cho Đoàn đại biểu tham gia phiên họp giả định 'Quốc hội trẻ em' lần thứ II năm 2024
https://baomoi.com/huyen-uy-tho-xuan-trien-khai-thuc-hien-chi-thi-so-35-cua-bo-chinh-tri-va-ke-hoach-to-chuc-dai-hoi-dang-bo-cac-cap-c50157934.epi,Huyện ủy Thọ Xuân triển khai thực hiện Chỉ thị số 35 của Bộ Chính trị và Kế hoạch tổ chức Đại hội Đảng bộ các cấp
https://baomoi.com/thanh-lap-chi-hoi-bao-ve-va-phat-huy-di-san-thuc-hanh-tin-nguong-tho-mau-tam-phu-cua-nguoi-viet-huyen-nam-truc-c50157279.epi,Thành lập Chi hội Bảo vệ và Phát huy di sản 'Thực hành tín ngưỡng thờ Mẫu Tam phủ của người Việt' huyện Nam Trực
https://baomoi.com/hon-50-hoc-vien-tham-gia-tap-huan-an-toan-thuc-pham-c50157974.epi,Hơn 50 học viên tham gia tập huấn an toàn thực phẩm
https://baomoi.com/tp-hcm-chuc-mung-gs-ts-bs-nguyen-thi-ngoc-phuong-nhan-giai-nobel-chau-a-c50157044.epi,TP HCM chúc mừng GS-TS-BS Nguyễn Thị Ngọc Phượng nhận 'Giải Nobel Châu Á'
https://baomoi.com/thanh-lap-chi-bo-co-so-cong-ty-co-phan-cau-kien-be-tong-quoc-vuong-c50156974.epi,Thành lập Chi bộ cơ sở Công ty cổ phần Cấu kiện bê tông Quốc Vương
https://baomoi.com/dong-nai-trien-khai-quyet-dinh-cua-ban-bi-thu-ve-cong-tac-can-bo-c50156993.epi,Đồng Nai triển khai quyết định của Ban Bí thư về công tác cán bộ
https://baomoi.com/don-bien-phong-tong-le-chan-tich-cuc-xay-dung-canh-quan-don-vi-xanh-sach-dep-c50157164.epi,"Đồn Biên phòng Tống Lê Chân: Tích cực xây dựng cảnh quan đơn vị xanh, sạch, đẹp"
https://baomoi.com/cong-an-cac-don-vi-dia-phuong-o-tinh-dak-nong-tiep-tuc-quyen-gop-ung-ho-dong-bao-bi-thiet-hai-do-bao-so-3-c50156907.epi,"Công an các đơn vị, địa phương ở tỉnh Đắk Nông tiếp tục quyên góp, ủng hộ đồng bào bị thiệt hại do bão số 3"
https://baomoi.com/tang-cuong-hop-tac-viet-nam-an-do-tai-lhq-c50156893.epi,Tăng cường hợp tác Việt Nam - Ấn Độ tại LHQ
https://baomoi.com/thanh-pho-yen-bai-ty-le-dieu-tra-kham-pha-an-binh-quan-tu-85-nam-tro-len-c50157186.epi,Thành phố Yên Bái:Tỷ lệ điều tra khám phá án bình quân từ 85%/năm trở lên
https://baomoi.com/dau-an-hoi-dau-khi-viet-nam-voi-su-phat-trien-nganh-dau-khi-c50156840.epi,Dấu ấn Hội Dầu khí Việt Nam với sự phát triển ngành Dầu khí
https://baomoi.com/khai-mac-phien-hop-lan-thu-37-cua-uy-ban-thuong-vu-quoc-hoi-c50156850.epi,Khai mạc phiên họp lần thứ 37 của Ủy ban Thường vụ Quốc hội
https://baomoi.com/tap-huan-boi-duong-kien-thuc-ky-nang-va-kinh-nghiem-cho-nu-ung-cu-vien-tiem-nang-van-dong-tranh-cu-vao-cac-co-quan-dan-cu-c50157069.epi,"Tập huấn bồi dưỡng kiến thức, kỹ năng và kinh nghiệm cho nữ ứng cử viên tiềm năng vận động tranh cử vào các cơ quan dân cử"
https://baomoi.com/nhung-nguoi-con-cua-ban-mong-gop-phan-xoa-bo-hu-tuc-trong-tang-ma-c50156845.epi,Những người con của bản Mông góp phần xóa bỏ hủ tục trong tang ma
https://baomoi.com/giam-doc-cong-an-dong-nai-tham-gia-ban-thuong-vu-tinh-uy-c50156875.epi,Giám đốc Công an Đồng Nai tham gia Ban Thường vụ Tỉnh ủy
https://baomoi.com/ban-bi-thu-chi-dinh-chuan-y-nhan-su-3-tinh-c50148753.epi,"Ban Bí thư chỉ định, chuẩn y nhân sự 3 tỉnh"
https://baomoi.com/ong-ho-van-mung-lam-chu-tich-ubnd-tinh-an-giang-c50156830.epi,Ông Hồ Văn Mừng làm Chủ tịch UBND tỉnh An Giang
https://baomoi.com/hoi-dau-khi-viet-nam-dong-hanh-cung-petrovietnam-vuot-nhieu-kho-khan-thach-thuc-c50156831.epi,"Hội Dầu khí Việt Nam đồng hành cùng Petrovietnam vượt nhiều khó khăn, thách thức"
https://baomoi.com/thu-phu-quyt-hong-dong-thap-dat-chuan-huyen-nong-thon-moi-c50156700.epi,'Thủ phủ' quýt hồng Đồng Tháp đạt chuẩn huyện nông thôn mới
https://baomoi.com/bi-thu-thanh-uy-nha-trang-lam-chu-tich-ubnd-tinh-an-giang-c50156713.epi,Bí thư Thành ủy Nha Trang làm Chủ tịch UBND tỉnh An Giang
https://baomoi.com/ky-ket-chuong-trinh-phoi-hop-trong-linh-vuc-moi-truong-giai-doan-nam-2024-2030-c50156894.epi,Ký kết chương trình phối hợp trong lĩnh vực môi trường giai đoạn năm 2024 - 2030
https://baomoi.com/ban-bi-thu-chi-dinh-giam-doc-cong-an-tinh-nguyen-hong-phong-tham-gia-ban-chap-hanh-ban-thuong-vu-tinh-uy-c50156723.epi,"Ban Bí thư chỉ định Giám đốc Công an tỉnh Nguyễn Hồng Phong tham gia Ban Chấp hành, Ban Thường vụ Tỉnh ủy"
https://baomoi.com/khai-mac-hoi-nghi-lan-thu-8-mang-luoi-cong-vien-dia-chat-toan-cau-unesco-khu-vuc-chau-a-thai-binh-duong-nam-2024-c50156669.epi,Khai mạc hội nghị lần thứ 8 Mạng lưới Công viên địa chất toàn cầu UNESCO khu vực châu Á - Thái Bình Dương năm 2024
https://baomoi.com/vun-dap-moi-quan-he-huu-nghi-vi-dai-doan-ket-dac-biet-va-hop-tac-toan-dien-viet-nam-lao-c50156604.epi,"Vun đắp mối quan hệ hữu nghị vĩ đại, đoàn kết đặc biệt và hợp tác toàn diện Việt Nam - Lào"
https://baomoi.com/khai-mac-hoi-nghi-quoc-te-lan-thu-8-mang-luoi-cong-vien-dia-chat-chau-a-thai-binh-duong-c50156813.epi,Khai mạc hội nghị quốc tế lần thứ 8 Mạng lưới Công viên địa chất châu Á-Thái Bình Dương
https://baomoi.com/co-hoi-de-cong-nghiep-tp-hcm-sang-giai-doan-moi-c50156980.epi,Cơ hội để công nghiệp TP.HCM sang giai đoạn mới
https://baomoi.com/tong-bi-thu-chu-tich-nuoc-to-lam-du-le-khai-giang-tai-hoc-vien-quoc-phong-c50156595.epi,"Tổng Bí thư, Chủ tịch nước Tô Lâm dự Lễ khai giảng tại Học viện Quốc phòng"
https://baomoi.com/du-kien-1500-dai-bieu-se-tham-du-dien-dan-kinh-te-tp-hcm-lan-5-c50156569.epi,Dự kiến 1500 đại biểu sẽ tham dự Diễn đàn Kinh tế TP.HCM lần 5
https://baomoi.com/uy-ban-thuong-vu-quoc-hoi-siet-chat-ky-luat-ky-cuong-trong-xay-dung-phap-luat-c50156512.epi,"Ủy ban Thường vụ Quốc hội: Siết chặt kỷ luật, kỷ cương trong xây dựng pháp luật"
https://baomoi.com/chuyen-doi-cong-nghiep-kinh-nghiem-va-cac-uu-tien-trong-hop-tac-phat-trien-c50156483.epi,Chuyển đổi công nghiệp: Kinh nghiệm và các ưu tiên trong hợp tác phát triển
https://baomoi.com/nhieu-bo-nganh-dinh-che-tai-chinh-quoc-te-tham-gia-dien-dan-kinh-te-tp-hcm-2024-c50156514.epi,"Nhiều bộ ngành, định chế tài chính quốc tế tham gia Diễn đàn Kinh tế TP HCM 2024"
https://baomoi.com/an-giang-co-chu-tich-ubnd-tinh-sau-gan-9-thang-khuyet-vi-tri-nay-c50156736.epi,An Giang có Chủ tịch UBND tỉnh sau gần 9 tháng khuyết vị trí này
https://baomoi.com/ha-noi-tao-dieu-kien-cho-cac-du-an-hop-tac-voi-phap-c50156409.epi,Hà Nội tạo điều kiện cho các dự án hợp tác với Pháp
https://baomoi.com/tham-van-y-kien-ve-qua-trinh-hinh-thanh-phat-trien-cua-hoi-dong-dan-toc-c50156444.epi,"Tham vấn ý kiến về quá trình hình thành, phát triển của Hội đồng Dân tộc"
https://baomoi.com/truong-dai-hoc-csnd-dao-tao-nhung-si-quan-canh-sat-vua-hong-vua-chuyen-c50157340.epi,"Trường Đại học CSND đào tạo những sĩ quan Cảnh sát 'vừa hồng, vừa chuyên'"
https://baomoi.com/doan-ket-xay-dung-huyen-kbang-ngay-cang-giau-dep-van-minh-c50156360.epi,"Đoàn kết xây dựng huyện Kbang ngày càng giàu đẹp, văn minh"
https://baomoi.com/tuyen-truyen-ve-an-toan-giao-thong-cho-can-bo-mat-tran-co-so-tai-an-khe-c50156373.epi,Tuyên truyền về an toàn giao thông cho cán bộ Mặt trận cơ sở tại An Khê
https://baomoi.com/du-thao-luat-hoa-chat-sua-doi-se-giam-5-nhom-thu-tuc-hanh-chinh-so-voi-hien-nay-c50156413.epi,Dự thảo Luật Hóa chất (sửa đổi): Sẽ giảm 5 nhóm thủ tục hành chính so với hiện nay
https://baomoi.com/ong-ho-van-mung-giu-chuc-chu-tich-ubnd-tinh-an-giang-nhiem-ky-2021-2026-c50156478.epi,Ông Hồ Văn Mừng giữ chức Chủ tịch UBND tỉnh An Giang nhiệm kỳ 2021 – 2026
https://baomoi.com/tam-long-cua-nhung-nguoi-con-xa-xu-gui-ve-vung-lu-lut-o-que-nha-c50156481.epi,Tấm lòng của những người con xa xứ gửi về vùng lũ lụt ở quê nhà
https://baomoi.com/thanh-nien-ha-tinh-xung-kich-tinh-nguyen-sang-tao-hoi-nhap-phat-trien-c50156525.epi,Thanh niên Hà Tĩnh xung kích - tình nguyện - sáng tạo - hội nhập - phát triển
https://baomoi.com/doan-kiem-tra-cua-bo-chinh-tri-lam-viec-voi-ban-thuong-vu-tinh-uy-quang-tri-c50157825.epi,Đoàn kiểm tra của Bộ Chính trị làm việc với Ban Thường vụ Tỉnh ủy Quảng Trị
https://baomoi.com/khai-mac-hoi-nghi-cong-vien-dia-chat-toan-cau-unesco-chau-a-thai-binh-duong-c50156278.epi,Khai mạc Hội nghị Công viên địa chất toàn cầu UNESCO châu Á-Thái Bình Dương
https://baomoi.com/tphcm-chao-don-tong-bi-thu-chu-tich-nuoc-lao-thongloun-sisoulith-c50156318.epi,"TPHCM chào đón Tổng Bí thư, Chủ tịch nước Lào Thongloun Sisoulith"
https://baomoi.com/chu-tich-quoc-hoi-tran-thanh-man-cac-luat-nghi-quyet-ra-doi-phai-co-chat-luong-va-tuoi-tho-c50156445.epi,"Chủ tịch Quốc hội Trần Thanh Mẫn: Các luật, nghị quyết ra đời phải có chất lượng và tuổi thọ"
https://baomoi.com/tan-pho-bi-thu-tinh-uy-ho-van-mung-duoc-bau-lam-chu-tich-ubnd-tinh-an-giang-c50156297.epi,Tân Phó Bí thư Tỉnh ủy Hồ Văn Mừng được bầu làm Chủ tịch UBND tỉnh An Giang
https://baomoi.com/tieu-su-dong-chi-ho-van-mung-tan-pho-bi-thu-tinh-uy-chu-tich-ubnd-tinh-an-giang-c50155038.epi,"Tiểu sử đồng chí Hồ Văn Mừng, tân Phó Bí thư Tỉnh ủy, Chủ tịch UBND tỉnh An Giang"
https://baomoi.com/doan-cong-tac-cua-bo-chinh-tri-lam-viec-tai-quang-tri-c50156448.epi,Đoàn công tác của Bộ Chính trị làm việc tại Quảng Trị
https://baomoi.com/ong-ho-van-mung-giu-chuc-pho-bi-thu-tinh-uy-chu-tich-ubnd-tinh-an-giang-c50156355.epi,"Ông Hồ Văn Mừng giữ chức Phó Bí thư Tỉnh ủy, Chủ tịch UBND tỉnh An Giang"
https://baomoi.com/uu-tien-doi-ngoai-cua-tan-thu-tuong-singapore-c50156277.epi,Ưu tiên đối ngoại của tân Thủ tướng Singapore
https://baomoi.com/ky-niem-70-nam-ngay-thanh-lap-dang-bo-95-nam-thanh-lap-do-thi-pleiku-tinh-gia-lai-c50156193.epi,"Kỷ niệm 70 năm Ngày thành lập Đảng bộ, 95 năm thành lập đô thị Pleiku tỉnh Gia Lai"
https://baomoi.com/hoi-nghi-quoc-te-lan-thu-8-mang-luoi-cong-vien-dia-chat-toan-cau-khu-vuc-chau-a-thai-binh-duong-c50156234.epi,Hội nghị quốc tế lần thứ 8 Mạng lưới Công viên địa chất toàn cầu khu vực châu Á-Thái Bình Dương
https://baomoi.com/bao-gia-lai-chinh-thuc-ra-mat-ban-tin-truyen-hinh-quoc-te-c50156153.epi,Báo Gia Lai chính thức ra mắt Bản tin truyền hình Quốc tế
https://baomoi.com/uy-ban-thuong-vu-quoc-hoi-quyen-gop-ung-ho-dong-bao-khac-phuc-hau-qua-bao-so-3-c50157644.epi,"Ủy ban Thường vụ Quốc hội quyên góp, ủng hộ đồng bào khắc phục hậu quả bão số 3"
https://baomoi.com/pho-bi-thu-tinh-uy-ho-van-mung-duoc-bau-lam-chu-tich-ubnd-tinh-an-giang-c50156157.epi,Phó Bí thư Tỉnh ủy Hồ Văn Mừng được bầu làm Chủ tịch UBND tỉnh An Giang
https://baomoi.com/dang-bo-tp-pleiku-ky-niem-70-nam-ngay-thanh-lap-va-don-nhan-huan-chuong-lao-dong-hang-nhi-c50156117.epi,Đảng bộ TP. Pleiku kỷ niệm 70 năm Ngày thành lập và đón nhận Huân chương Lao động hạng nhì
https://baomoi.com/tp-ho-chi-minh-se-to-chuc-hai-su-kien-kinh-te-lon-trong-thang-9-c50156103.epi,TP Hồ Chí Minh sẽ tổ chức hai sự kiện kinh tế lớn trong tháng 9
https://baomoi.com/phu-yen-hoi-thao-khoa-hoc-ve-55-nam-thuc-hien-di-chuc-cua-chu-tich-ho-chi-minh-c50156054.epi,Phú Yên hội thảo khoa học về 55 năm thực hiện Di chúc của Chủ tịch Hồ Chí Minh
https://baomoi.com/xay-dung-gia-dinh-hanh-phuc-cong-dong-hanh-phuc-c50156115.epi,"Xây dựng gia đình hạnh phúc, cộng đồng hạnh phúc"
https://baomoi.com/phoi-hop-tiep-cong-dan-dam-bao-an-ninh-trat-tu-phuc-vu-dai-hoi-dang-cac-cap-c50156600.epi,"Phối hợp tiếp công dân, đảm bảo an ninh, trật tự phục vụ Đại hội Đảng các cấp"
https://baomoi.com/cac-to-chuc-quoc-te-tich-cuc-ho-tro-viet-nam-khac-phuc-hau-qua-bao-lu-c50156705.epi,Các tổ chức quốc tế tích cực hỗ trợ Việt Nam khắc phục hậu quả bão lũ
https://baomoi.com/giam-sat-viec-lanh-dao-thuc-hien-nhiem-vu-quoc-phong-quan-su-dia-phuong-doi-voi-dang-uy-ban-dan-toc-tinh-c50156677.epi,"Giám sát việc lãnh đạo thực hiện nhiệm vụ quốc phòng, quân sự địa phương đối với Đảng ủy Ban Dân tộc tỉnh"
https://baomoi.com/to-chuc-hoi-nghi-truc-tuyen-duyet-cong-tac-chuan-bi-dai-hoi-dai-bieu-hoi-lien-hiep-thanh-nien-viet-nam-tinh-soc-trang-lan-thu-vii-nhiem-ky-2024-2029-c50156134.epi,"Tổ chức Hội nghị trực tuyến duyệt công tác chuẩn bị Đại hội đại biểu Hội Liên hiệp Thanh niên Việt Nam tỉnh Sóc Trăng lần thứ VII, nhiệm kỳ 2024 - 2029"
https://baomoi.com/bo-truong-cong-an-viet-nam-tham-va-lam-viec-tai-lien-bang-nga-c50156092.epi,Bộ trưởng Công an Việt Nam thăm và làm việc tại Liên bang Nga
https://baomoi.com/khai-mac-hoi-nghi-quoc-te-lan-thu-8-mang-luoi-cvdc-toan-cau-unesco-khu-vuc-chau-a-thai-binh-duong-c50156064.epi,Khai mạc Hội nghị quốc tế lần thứ 8 Mạng lưới CVĐC toàn cầu UNESCO khu vực Châu Á - Thái Bình Dương
https://baomoi.com/uy-ban-thuong-vu-khai-mac-phien-hop-37-khan-truong-cho-y-kien-23-noi-dung-quan-trong-c50156287.epi,"Ủy ban Thường vụ khai mạc Phiên họp 37, khẩn trương cho ý kiến 23 nội dung quan trọng"
https://baomoi.com/van-phong-quoc-hoi-quyen-gop-ung-ho-dong-bao-khac-phuc-hau-qua-con-bao-so-3-c50156286.epi,"Văn phòng Quốc hội quyên góp, ủng hộ đồng bào khắc phục hậu quả cơn bão số 3"
https://baomoi.com/khai-mac-hoi-nghi-quoc-te-lan-thu-8-cua-mang-luoi-cong-vien-dia-chat-cvdc-toan-cau-unesco-khu-vuc-chau-a-thai-binh-duong-c50155981.epi,Khai mạc Hội nghị quốc tế lần thứ 8 của Mạng lưới Công viên địa chất (CVĐC) toàn cầu UNESCO khu vực châu Á - Thái Bình Dương
https://baomoi.com/tong-cong-ty-vtc-ky-ket-hop-tac-voi-cong-ty-mekonglink-c50156020.epi,Tổng công ty VTC ký kết hợp tác với công ty Mekonglink
https://baomoi.com/mat-tran-tinh-nam-dinh-tiep-nhan-ung-ho-dong-bao-bi-thien-tai-c50155992.epi,Mặt trận tỉnh Nam Định tiếp nhận ủng hộ đồng bào bị thiên tai
https://baomoi.com/canh-sat-bien-dong-hanh-voi-ngu-dan-huyen-dao-ly-son-c50156059.epi,Cảnh sát biển đồng hành với ngư dân huyện đảo Lý Sơn
https://baomoi.com/ong-ho-van-mung-duoc-bau-giu-chuc-chu-tich-ubnd-tinh-an-giang-c50156037.epi,Ông Hồ Văn Mừng được bầu giữ chức Chủ tịch UBND tỉnh An Giang
https://baomoi.com/doi-thoai-lan-thu-9-giua-dang-dan-chu-xa-hoi-duc-va-dang-cong-san-viet-nam-c50156093.epi,Đối thoại lần thứ 9 giữa Đảng Dân chủ Xã hội Đức và Đảng Cộng sản Việt Nam
https://baomoi.com/chuan-bi-chu-dao-cho-dai-hoi-hoi-doanh-nhan-cuu-chien-binh-tinh-khoa-2-c50155945.epi,Chuẩn bị chu đáo cho đại hội Hội Doanh nhân cựu chiến binh tỉnh khóa 2
https://baomoi.com/cong-an-huyen-bau-bang-lang-nghe-y-kien-nhan-dan-c50155924.epi,Công an huyện Bàu Bàng lắng nghe ý kiến nhân dân
