url,title
https://baomoi.com/truong-ban-tuyen-giao-t-u-bao-chi-va-tuyen-truyen-can-thich-ung-voi-su-phat-trien-manh-me-cua-cong-nghe-so-va-tri-tue-nhan-tao-c50157107.epi,Trưởng ban Tuyên giáo T.Ư: Báo chí và tuyên truyền cần thích ứng với sự phát triển mạnh mẽ của công nghệ số và trí tuệ nhân tạo
https://baomoi.com/lai-chau-tap-huan-xay-dung-cac-van-kien-dai-hoi-c50155877.epi,Lai Châu tập huấn xây dựng các văn kiện Đại hội
https://baomoi.com/dong-gop-du-thao-luat-phong-khong-nhan-dan-c50156013.epi,Đóng góp dự thảo Luật Phòng không nhân dân
https://baomoi.com/binh-chung-dac-cong-huong-phong-trao-thi-dua-quyet-thang-vao-nang-cao-trinh-do-kha-nang-san-sang-chien-dau-c50155963.epi,"Binh chủng Đặc công: Hướng Phong trào Thi đua Quyết thắng vào nâng cao trình độ, khả năng sẵn sàng chiến đấu"
https://baomoi.com/su-doan-bo-binh-2-quan-khu-5-dien-tap-ban-dan-that-c50155964.epi,Sư đoàn Bộ binh 2 (Quân khu 5) diễn tập bắn đạn thật
https://baomoi.com/khai-mac-phien-hop-thu-37-uy-ban-thuong-vu-quoc-hoi-c50155974.epi,"Khai mạc Phiên họp thứ 37, Ủy ban Thường vụ Quốc hội"
https://baomoi.com/boi-duong-nghiep-vu-cong-tac-noi-chinh-phong-chong-tham-nhung-tieu-cuc-va-cai-cach-tu-phap-c50155917.epi,"Bồi dưỡng nghiệp vụ công tác nội chính, phòng chống tham nhũng, tiêu cực và cải cách tư pháp"
https://baomoi.com/ong-ho-van-mung-duoc-bau-lam-chu-tich-ubnd-tinh-an-giang-c50155823.epi,Ông Hồ Văn Mừng được bầu làm Chủ tịch UBND tỉnh An Giang
https://baomoi.com/thanh-lap-chi-bo-co-so-cong-ty-tnhh-long-fa-c50155763.epi,Thành lập Chi bộ cơ sở Công ty TNHH Long Fa
https://baomoi.com/tong-bi-thu-chu-tich-nuoc-du-khai-giang-hoc-vien-quoc-phong-c50155904.epi,"Tổng Bí thư, Chủ tịch nước dự khai giảng Học viện Quốc phòng"
https://baomoi.com/thanh-lap-hoi-khoi-nghiep-doi-moi-sang-tao-tinh-kien-giang-buoc-dot-pha-cho-phat-trien-kinh-te-dia-phuong-c50155738.epi,Thành lập Hội Khởi nghiệp Đổi mới Sáng tạo tỉnh Kiên Giang: Bước đột phá cho phát triển kinh tế địa phương
https://baomoi.com/thu-truong-le-van-tuyen-tham-du-dien-dan-hop-tac-an-ninh-cong-dong-toan-cau-c50156038.epi,Thứ trưởng Lê Văn Tuyến tham dự Diễn đàn hợp tác An ninh cộng đồng toàn cầu
https://baomoi.com/doan-kiem-tra-cua-bo-chinh-tri-lam-viec-voi-ban-thuong-vu-tinh-uy-quang-tri-c50155975.epi,Đoàn kiểm tra của Bộ Chính trị làm việc với Ban Thường vụ Tỉnh ủy Quảng Trị
https://baomoi.com/doi-thoai-huu-nghi-va-dien-dan-kinh-te-tp-hcm-nam-2024-co-gi-dac-biet-c50155691.epi,Đối thoại Hữu nghị và Diễn đàn Kinh tế TP HCM năm 2024 có gì đặc biệt?
https://baomoi.com/tong-bi-thu-chu-tich-nuoc-to-lam-du-le-khai-giang-nam-hoc-moi-cua-hoc-vien-quoc-phong-c50155723.epi,"Tổng Bí thư, Chủ tịch nước Tô Lâm dự Lễ khai giảng năm học mới của Học viện Quốc phòng"
https://baomoi.com/tong-bi-thu-chu-tich-nuoc-to-lam-du-le-khai-giang-hoc-vien-quoc-phong-c50155638.epi,"Tổng Bí thư, Chủ tịch nước Tô Lâm dự Lễ khai giảng Học viện Quốc phòng"
https://baomoi.com/xuat-hien-con-bao-moi-ngoai-khoi-philippines-kha-nang-manh-thanh-bao-cuong-phong-c50146996.epi,"Xuất hiện cơn bão mới ngoài khơi Philippines, khả năng mạnh thành bão cuồng phong"
https://baomoi.com/bao-francine-tang-cap-sieu-toc-dich-chuyen-duong-di-c50151280.epi,"Bão Francine tăng cấp siêu tốc, dịch chuyển đường đi"
https://baomoi.com/chan-dung-nu-dien-vien-noi-tieng-den-tam-lu-ho-tro-nguoi-dan-c50152320.epi,Chân dung nữ diễn viên nổi tiếng đến tâm lũ hỗ trợ người dân
https://baomoi.com/dap-thuy-dien-lon-nhat-viet-nam-la-niem-tu-hao-cua-tri-tue-viet-di-vao-lich-su-vi-loat-ky-luc-co-1-0-2-c50151210.epi,"Đập thủy điện lớn nhất Việt Nam: Là niềm tự hào của trí tuệ Việt, đi vào lịch sử vì loạt kỷ lục có 1-0-2"
https://baomoi.com/bao-francine-tang-cap-sieu-toc-co-kha-nang-manh-thanh-cuong-phong-tam-diem-noi-nao-c50155498.epi,"Bão Francine tăng cấp siêu tốc có khả năng mạnh thành cuồng phong, tâm điểm nơi nào?"
https://baomoi.com/thuy-dien-thac-ba-nhung-phut-giay-nin-tho-c50151853.epi,"Thủy điện Thác Bà, những phút giây nín thở"
https://baomoi.com/su-that-buc-anh-chong-dam-minh-trong-nuoc-lu-om-chau-nhua-so-tan-vo-con-c50151535.epi,Sự thật bức ảnh chồng dầm mình trong nước lũ ôm chậu nhựa sơ tán vợ con
https://baomoi.com/co-dong-bo-cau-o-hai-duong-nin-khoc-khi-toa-dua-bang-chung-c50148245.epi,'Cô đồng bổ cau' ở Hải Dương nín khóc khi tòa đưa bằng chứng
https://baomoi.com/5-loai-xang-dau-giam-manh-ron95-chua-den-20-000-dong-lit-c50158176.epi,"5 loại xăng dầu giảm mạnh, RON95 chưa đến 20.000 đồng/lít"
https://baomoi.com/hai-duong-nguoi-dan-dung-xe-ngoi-lan-can-ven-ql5-cau-ca-c50158098.epi,"Hải Dương: Người dân dựng xe, ngồi lan can ven QL5 câu cá"
https://baomoi.com/cong-nhan-dien-luc-ha-tinh-tan-tam-cuu-dong-dien-mien-bac-c50158085.epi,Công nhân Điện lực Hà Tĩnh tận tâm 'cứu' dòng điện miền Bắc
https://baomoi.com/cong-nhan-dien-luc-ha-tinh-tan-tam-cuu-dong-dien-mien-bac-c50158085.epi,Công nhân Điện lực Hà Tĩnh tận tâm 'cứu' dòng điện miền Bắc
https://baomoi.com/agribank-chung-suc-cung-cac-dia-phuong-khac-phuc-hau-qua-bao-so-3-c50158018.epi,Agribank chung sức cùng các địa phương khắc phục hậu quả bão số 3
https://baomoi.com/hoi-luat-gia-tinh-hung-yen-tiep-tuc-xay-dung-hoi-ngay-cang-phat-trien-vung-manh-c50157990.epi,Hội Luật gia tỉnh Hưng Yên: Tiếp tục xây dựng Hội ngày càng phát triển vững mạnh
https://baomoi.com/hang-cuu-tro-da-den-yen-bai-chuan-bi-duoc-trao-gui-toi-ba-con-vung-ngap-lut-c50157138.epi,"Hàng cứu trợ đã đến Yên Bái, chuẩn bị được trao gửi tới bà con vùng ngập lụt"
https://baomoi.com/nganh-du-lich-mien-bac-gop-suc-khac-phuc-hau-qua-mua-lu-c50156690.epi,Ngành du lịch miền Bắc góp sức khắc phục hậu quả mưa lũ
https://baomoi.com/dan-nghe-si-tich-cuc-chuan-bi-nhu-yeu-pham-len-duong-cuu-tro-dong-bao-mien-bac-c50156513.epi,"Dàn nghệ sĩ tích cực chuẩn bị nhu yếu phẩm, lên đường cứu trợ đồng bào miền Bắc"
https://baomoi.com/phu-nu-chon-thanh-chia-lua-voi-nguoi-dan-mien-bac-c50155439.epi,Phụ nữ Chơn Thành 'chia lửa' với người dân miền Bắc
https://baomoi.com/nha-nha-nguoi-nguoi-chung-tay-huong-ve-dong-bao-bao-lu-c50155465.epi,"Nhà nhà, người người chung tay hướng về đồng bào bão lũ"
https://baomoi.com/5-loai-xang-dau-giam-manh-ron95-chua-den-20-000-dong-lit-c50158176.epi,"5 loại xăng dầu giảm mạnh, RON95 chưa đến 20.000 đồng/lít"
https://baomoi.com/giam-hon-1-000-dong-xang-ron95-xuong-con-19-500-dong-moi-lit-c50158199.epi,"Giảm hơn 1.000 đồng, xăng RON95 xuống còn 19.500 đồng mỗi lít"
https://baomoi.com/gia-xang-giam-hon-1-000-dong-lit-xang-ron-95-ve-duoi-20-ngan-dong-lit-c50158117.epi,"Giá xăng giảm hơn 1.000 đồng/lít, xăng RON 95 về dưới 20 ngàn đồng/lít"
https://baomoi.com/gia-xang-dau-dong-loat-giam-manh-xang-ron95-iii-xuong-muc-19-635-dong-lit-c50157964.epi,"Giá xăng dầu đồng loạt giảm mạnh, xăng RON95-III xuống mức 19.635 đồng/lít"
https://baomoi.com/gia-xang-dau-hom-nay-12-9-dong-loat-giam-sau-c50157928.epi,Giá xăng dầu hôm nay 12/9: Đồng loạt giảm sâu
https://baomoi.com/60-ngay-truoc-bau-cu-my-mot-cuoc-bau-cu-khong-co-tien-le-c50141790.epi,60 ngày trước bầu cử Mỹ: Một cuộc bầu cử không có tiền lệ
https://baomoi.com/tan-tong-thong-iran-va-co-hoi-cho-hoa-binh-trung-dong-c50078072.epi,Tân Tổng thống Iran và cơ hội cho hòa bình Trung Đông
https://baomoi.com/con-khat-dat-hiem-toan-cau-va-su-chiem-linh-cua-trung-quoc-c50085408.epi,'Cơn khát' đất hiếm toàn cầu và sự chiếm lĩnh của Trung Quốc
https://baomoi.com/vi-dau-gojek-bi-danh-bat-khoi-viet-nam-c50084240.epi,Vì đâu Gojek bị đánh bật khỏi Việt Nam?
https://baomoi.com/cap-quang-cuoc-chien-ngam-tri-gia-hang-nghin-ty-usd-c50063840.epi,Cáp quang - Cuộc chiến ngầm trị giá hàng nghìn tỷ USD
https://baomoi.com/thay-gi-tu-cuoc-khung-hoang-dich-dau-mua-khi-o-chau-phi-c50065488.epi,Thấy gì từ cuộc khủng hoảng dịch đậu mùa khỉ ở châu Phi?
https://baomoi.com/hy-vong-chot-cua-ong-trump-c50060595.epi,Hy vọng chót của ông Trump?
https://baomoi.com/my-va-ke-hoach-trien-khai-ten-lua-gay-tranh-cai-c50057409.epi,Mỹ và kế hoạch triển khai tên lửa gây tranh cãi
